fecha,fuente,metodo,estado,dictamen,accion,nota
2026-04-03,Pliego,lectura material,SIN_CONFLICTO,SOSTENER_SUBORDINACION,MANTENER,El repositorio no se presenta como doctrina ni como motor completo.
2026-04-03,FT-SV-IA/001,lectura material,SIN_CONFLICTO,SOSTENER_SUBORDINACION,MANTENER,La frontera externa permanece subordinada y no decide el dictamen.
2026-04-03,SV-lenguaje-de-computacion,lectura cruzada,SIN_CONFLICTO,SIN_FORZAR_GRAMATICA,PREPARAR_PIEZA_SVP,La futura capa `.svp` debe subordinarse a este frente.
2026-04-03,Seguridad estructural,lectura material,SIN_CONFLICTO,COMPUESTA_MINIMA_INTEGRADA,MANTENER,La compuerta mínima de custodia queda activa.
2026-04-03,Coleccion I y Documento 3,lectura material,SIN_CONFLICTO,ESTADO_PILOTO_RECONOCIDO,MANTENER,No usar el frente NLP para cierre impropio del motor.
