id,objeto,descripcion,soporte,estado,nota
DV-SVM-001,Sincronizacion con Documento 3 y frente NLP,La sincronizacion material completa sigue abierta,docs/estado y docs/fundamentos,ABIERTA,No cerrar el motor usando NLP como atajo.
DV-SVM-002,Especificacion de transduccion a `.svp`,La necesidad está fijada pero la pieza ejecutable no existe todavia,docs/arquitectura y docs/interfaces,ABIERTA,Debe quedar subordinada al repositorio del Lenguaje SV.
DV-SVM-003,Agente especializado en IA,La posibilidad está habilitada pero no cerrada por el camino documental 4→9,docs/fundamentos,ABIERTA,No declararlo existente antes del cierre suficiente del camino critico.
DV-SVM-004,Capa visual especializada,La capa es necesaria pero su estatuto y su baseline arquitectural no están todavía fijados completamente,docs/arquitectura,ABIERTA,No hacerla soberana ni reducirla a mero editor gráfico.
DV-SVM-005,Capa generativa DEV,La capa generativa del dominio DEV no procede todavía,docs/gobierno y docs/arquitectura,ABIERTA,Su estudio queda subordinado al cierre algebraico previo.
DV-SVM-006,Comparacion real Python vs Rust/.svp,La doble vara con salida Rust real queda pendiente hasta que DV-SVM-002 esté implementado,src/sv_motor/verification,ABIERTA,Implementar cuando el backend Rust produzca JSON canonico
DV-SVM-007,Artefacto Python derivado de `.svp`,La derivacion paralela Python desde el mismo expediente del programa `.svp` no esta todavia implementada,docs/interfaces y docs/arquitectura,ABIERTA,Debe existir solo como cotejo reproducible y no como segunda semantica.
